{
  "id": "droidtop.sample-py-statustile",
  "origin": "droidtop",
  "label": "Sample status tile (Python)",
  "description": "Harmless python-kind sample exercising the plugin API end to end (SPEC 12a); see build.sh in this folder.",
  "version": "1.2.0",
  "kind": "python",
  "contractVersion": 2,
  "permissions": [
    {"id": "overlay.toast", "reason": "Says hello when you press Say hello as a toast on its panel"}
  ],
  "requestsRoot": false,
  "abis": [],
  "provides": [
    {
      "point": "ui.status_tile",
      "version": 1,
      "id": "state",
      "label": "Sample tile (python)",
      "surfaces": ["gaming.quick_menu"]
    },
    {
      "point": "ui.panel",
      "version": 1,
      "label": "Sample (python)"
    },
    {
      "point": "ui.settings",
      "version": 1,
      "target": "plugin"
    }
  ]
}
