{
  "id": "droidtop.sample-flutter-statustile",
  "origin": "droidtop",
  "label": "Sample status tile (Flutter)",
  "description": "Harmless flutter_embed-kind sample exercising the plugin API end to end (SPEC 12a); see build.sh in this folder.",
  "version": "1.0.0",
  "kind": "flutter_embed",
  "contractVersion": 2,
  "runtimeVersion": "af7e796e161ae0bb1ff0758c71a7105418bd9ded",
  "requestsRoot": false,
  "provides": [
    {"point":"ui.status_tile","version":1,"id":"state","label":"Sample tile (Flutter)","surfaces":["gaming.quick_menu"]},
    {"point":"ui.settings","version":1,"target":"plugin"}
  ],
  "abis": ["arm64-v8a", "x86_64"]
}
